qno,page number,answer,no_of_lines,no_of_words,diagram_marks,diagram_path,starting_cords,ending_cords,diagram_cords,diagram_page
1,1, OSI stouds for open System interconnection Where open stands to say non-proprietary It is a 7 - Loyer archituture with Each loyer Specific functionality to perform. ,4,27,0,0,316.0,811.0,0,0
2,1," A local area network is a computer network that inter connects with a limited area such as a residence, school, laboratory and university LAN ",4,25,0,answer_papers/student2/diagram/ans_paper1_cropped_1.jpg|,811.0,1582.0,"313,1028,995,1512",1
3,2, TRUE ,1,2,0,0,1582.0,1703.0,0,0
4,2, Wide area network ,1,4,0,0,1703.0,1897.0,0,0
5,2, TCP is one of main protocol of Internet ,1,9,0,0,1897.0,1897.0,0,0
